{
  "date": "2026-03-19",
  "prepared_by": "FOUNDER_COS_001",
  "north_star_snapshot": {
    "traffic": 1240,
    "content_output": 6,
    "product_readiness": 0.71,
    "revenue_signal": 2,
    "compliance_exceptions_open": 1
  },
  "top_wins": [
    "Document upload API passed regression tests.",
    "Two denial-code pages cleared YMYL review.",
    "Founder dashboard blocker queue is now wired to event data."
  ],
  "top_risks": [
    "Telemetry completeness still below required threshold for launch confidence.",
    "One compliance exception remains open on template wording."
  ],
  "decisions_needed_today": [
    "Approve prioritization of telemetry completeness ahead of secondary SEO enhancements."
  ],
  "launch_blockers": [
    "trackedExecution coverage incomplete on one canonical path."
  ],
  "agent_health": [
    {"director": "DIR_ENG_001", "status": "yellow", "summary": "Shipping steady, one blocker in telemetry enforcement."},
    {"director": "DIR_CTK_001", "status": "green", "summary": "Content batches moving cleanly through review."},
    {"director": "DIR_TRC_001", "status": "yellow", "summary": "One exception under review."}
  ],
  "notes": "No specialist agent contacted founder directly."
}
